{
  "id": "brief_1772855464606_e300cf",
  "format": "explainer_v1",
  "version": "1.0",
  "created_at": "2026-03-07T03:51:04.606Z",
  "settings": {
    "resolution": {
      "width": 1080,
      "height": 1920
    },
    "fps": 30,
    "duration_sec": 18,
    "aspect_ratio": "9:16"
  },
  "style": {
    "theme": "dark",
    "font_heading": "Inter",
    "font_body": "Inter",
    "primary_color": "#ffffff",
    "secondary_color": "#a1a1aa",
    "accent_color": "#3b82f6",
    "background_type": "gradient",
    "background_value": "linear-gradient(135deg, #0a0a0a 0%, #1a1a2e 50%, #0a0a0a 100%)"
  },
  "sections": [
    {
      "id": "intro_001",
      "type": "intro",
      "duration_sec": 5,
      "start_time_sec": 0,
      "content": {
        "type": "intro",
        "title": "List jobs test card"
      }
    },
    {
      "id": "topic_001",
      "type": "topic",
      "duration_sec": 8,
      "start_time_sec": 5,
      "content": {
        "type": "topic",
        "heading": "Key Point",
        "body_text": "",
        "bullet_points": [],
        "animation_style": "slide"
      }
    },
    {
      "id": "outro_001",
      "type": "outro",
      "duration_sec": 5,
      "start_time_sec": 13,
      "content": {
        "type": "outro",
        "title": "Follow for More",
        "call_to_action": "Follow for more",
        "social_handles": []
      }
    }
  ],
  "audio": {
    "volume_music": 0.3,
    "volume_voice": 1
  }
}