{
  "id": "example_explainer_001",
  "format": "explainer_v1",
  "version": "1.0",
  "created_at": "2024-01-15T10:00:00Z",

  "settings": {
    "resolution": { "width": 1080, "height": 1920 },
    "fps": 30,
    "duration_sec": 60,
    "aspect_ratio": "9:16"
  },

  "style": {
    "theme": "dark",
    "primary_color": "#ffffff",
    "secondary_color": "#a1a1aa",
    "accent_color": "#3b82f6",
    "font_heading": "Inter",
    "font_body": "Inter",
    "background_type": "gradient",
    "background_value": "linear-gradient(135deg, #0a0a0a 0%, #1a1a2e 50%, #0a0a0a 100%)"
  },

  "sections": [
    {
      "id": "intro_001",
      "type": "intro",
      "duration_sec": 9,
      "start_time_sec": 0,
      "content": {
        "type": "intro",
        "title": "5 Productivity Hacks",
        "subtitle": "That Actually Work",
        "hook_text": "Stop wasting time on methods that don't deliver results"
      }
    },
    {
      "id": "topic_001",
      "type": "topic",
      "duration_sec": 12,
      "start_time_sec": 9,
      "content": {
        "type": "topic",
        "heading": "Time Blocking",
        "body_text": "Dedicate specific time slots to specific tasks. No multitasking allowed.",
        "bullet_points": [
          "Block 2-4 hour chunks for deep work",
          "Include buffer time between blocks",
          "Protect your most productive hours"
        ],
        "icon": "‚è∞",
        "animation_style": "slide"
      }
    },
    {
      "id": "topic_002",
      "type": "topic",
      "duration_sec": 12,
      "start_time_sec": 21,
      "content": {
        "type": "topic",
        "heading": "The 2-Minute Rule",
        "body_text": "If a task takes less than 2 minutes, do it immediately instead of adding it to your list.",
        "bullet_points": [
          "Reduces mental clutter",
          "Prevents small tasks from piling up",
          "Creates momentum for bigger tasks"
        ],
        "icon": "‚ö°",
        "animation_style": "fade"
      }
    },
    {
      "id": "topic_003",
      "type": "topic",
      "duration_sec": 12,
      "start_time_sec": 33,
      "content": {
        "type": "topic",
        "heading": "Weekly Reviews",
        "body_text": "Spend 30 minutes every week reviewing what worked and what didn't.",
        "bullet_points": [
          "Identify patterns in your productivity",
          "Adjust your system based on data",
          "Celebrate wins, learn from failures"
        ],
        "icon": "üìä",
        "animation_style": "slide"
      }
    },
    {
      "id": "topic_004",
      "type": "topic",
      "duration_sec": 6,
      "start_time_sec": 45,
      "content": {
        "type": "topic",
        "heading": "Environment Design",
        "body_text": "Design your workspace to minimize friction and maximize focus.",
        "icon": "üéØ",
        "animation_style": "zoom"
      }
    },
    {
      "id": "outro_001",
      "type": "outro",
      "duration_sec": 9,
      "start_time_sec": 51,
      "content": {
        "type": "outro",
        "title": "Start Today!",
        "call_to_action": "Follow for more productivity tips",
        "social_handles": [
          { "platform": "Instagram", "handle": "@productivity" },
          { "platform": "TikTok", "handle": "@prodtips" }
        ]
      }
    }
  ],

  "audio": {
    "background_music": "assets/audio/upbeat-corporate.mp3",
    "volume_music": 0.3,
    "volume_voice": 1.0
  }
}
