{
  "id": "brief_1773455941628_73c662",
  "format": "listicle_v1",
  "version": "1.0",
  "created_at": "2026-03-14T02:39:01.629Z",
  "settings": {
    "resolution": {
      "width": 1080,
      "height": 1920
    },
    "fps": 30,
    "duration_sec": 50,
    "aspect_ratio": "9:16"
  },
  "style": {
    "theme": "dark",
    "font_heading": "Inter",
    "font_body": "Inter",
    "primary_color": "#ffffff",
    "secondary_color": "#a1a1aa",
    "accent_color": "#00ff88",
    "background_type": "gradient",
    "background_value": "linear-gradient(135deg, #0a0a0a 0%, #1a1a2e 50%, #0a0a0a 100%)"
  },
  "sections": [
    {
      "id": "intro_001",
      "type": "intro",
      "duration_sec": 5,
      "start_time_sec": 0,
      "content": {
        "type": "intro",
        "title": "AI Market Report March 2026: What 100 Upwork Jobs Reveal",
        "hook_text": "68% of AI jobs aren't building AI — they're integrating it"
      }
    },
    {
      "id": "item_001",
      "type": "list_item",
      "duration_sec": 8,
      "start_time_sec": 5,
      "content": {
        "type": "list_item",
        "number": 1,
        "title": "AI Automation Dominates at 52%",
        "description": "n8n, Make.com & voice agents (Vapi/Retell) are the top demand — avg $518/project"
      }
    },
    {
      "id": "item_002",
      "type": "list_item",
      "duration_sec": 8,
      "start_time_sec": 13,
      "content": {
        "type": "list_item",
        "number": 2,
        "title": "$5,700 TikTok Pipeline = 30+ hrs/week saved",
        "description": "Fully automated: product input → AI video → auto-post. Pays for itself in 4 weeks"
      }
    },
    {
      "id": "item_003",
      "type": "list_item",
      "duration_sec": 8,
      "start_time_sec": 21,
      "content": {
        "type": "list_item",
        "number": 3,
        "title": "Voice AI Is the Biggest Gap",
        "description": "Vapi & Retell demand is exploding but specialist supply is nearly zero — $500-$2,000/agent"
      }
    },
    {
      "id": "item_004",
      "type": "list_item",
      "duration_sec": 8,
      "start_time_sec": 29,
      "content": {
        "type": "list_item",
        "number": 4,
        "title": "Agentic Systems Command $1,500–$5,000+",
        "description": "Clients want multi-step AI agents that research, decide & act — not just single automations"
      }
    },
    {
      "id": "item_005",
      "type": "list_item",
      "duration_sec": 8,
      "start_time_sec": 37,
      "content": {
        "type": "list_item",
        "number": 5,
        "title": "Content Factories > Content Creators",
        "description": "End-to-end AI pipelines for TikTok, LinkedIn & Instagram: $2,000–$6,000 build + $500/mo retainer"
      }
    },
    {
      "id": "outro_001",
      "type": "outro",
      "duration_sec": 5,
      "start_time_sec": 45,
      "content": {
        "type": "outro",
        "title": "Found this helpful?",
        "call_to_action": "Subscribe for weekly AI market analysis",
        "social_handles": [
          {
            "platform": "TikTok",
            "handle": "@isaiah_dupree"
          }
        ]
      }
    }
  ],
  "audio": {
    "volume_music": 0.3,
    "volume_voice": 1,
    "voiceover_path": "/Users/isaiahdupree/Documents/Software/Remotion/output/voiceovers/vo_1773455834546.wav"
  }
}