{
  "id": "brief_1774225219258_171934",
  "format": "shorts_v1",
  "version": "1.0",
  "created_at": "2026-03-23T00:20:19.262Z",
  "settings": {
    "resolution": {
      "width": 1080,
      "height": 1920
    },
    "fps": 30,
    "duration_sec": 15,
    "aspect_ratio": "9:16"
  },
  "style": {
    "theme": "dark",
    "font_heading": "Inter",
    "font_body": "Inter",
    "primary_color": "#ffffff",
    "secondary_color": "#a1a1aa",
    "accent_color": "#00d4ff",
    "background_type": "gradient",
    "background_value": "linear-gradient(135deg, #0a0a0a 0%, #1a1a2e 50%, #0a0a0a 100%)"
  },
  "sections": [
    {
      "id": "hook_001",
      "type": "hook",
      "duration_sec": 3,
      "start_time_sec": 0,
      "content": {
        "type": "hook",
        "text": "Why hasn't this AI architecture been done before?"
      }
    },
    {
      "id": "content_001",
      "type": "content",
      "duration_sec": 9,
      "start_time_sec": 3,
      "content": {
        "type": "topic",
        "heading": "Why I'm Abandoning Everything I Built",
        "body_text": {
          "heading": "The Old World",
          "body_text": "Drop shipping was the topic of its time. I built content around it. Then everything changed.",
          "bullet_points": []
        },
        "animation_style": "fade"
      }
    },
    {
      "id": "cta_001",
      "type": "cta",
      "duration_sec": 3,
      "start_time_sec": 12,
      "content": {
        "type": "cta",
        "title": "Follow for AI tools & agents",
        "action_text": "Follow",
        "url": "@isaiahdupree"
      }
    }
  ],
  "audio": {
    "volume_music": 0.3,
    "volume_voice": 1
  }
}